<?xml version="1.0" encoding="UTF-8"?>
<!DOCTYPE seqopcodes SYSTEM "seqopcodes.dtd">
<seqopcodes>
    <!-- OLD OPCODES - these need updating still post 1/26/2005 

    <opcode id="02a5" name="OP_UserCompInfo" updated="02/10/04">
        <comment>User submitted computer information</comment>
    </opcode>
    <opcode id="02db" name="OP_LoginComplete" updated="02/10/04">
        <comment></comment>
    </opcode>
-->


    <opcode id="407c" name="OP_ZoneServerInfo" updated="06/29/05">
        <comment>old ZoneServerInfo</comment>
    </opcode>
    <opcode id="732c" name="OP_SendCharInfo" updated="06/29/05">
        <comment>Send all chars visible @ char select</comment>
    </opcode>
    <opcode id="7fea" name="OP_MOTD" updated="06/29/05">
        <comment>old MOTDCode Server message of the day</comment>
        <payload dir="server" typename="worldMOTDStruct" sizechecktype="none"/>
    </opcode>
    <opcode id="6957" name="OP_GuildList" updated="06/29/05">
        <comment>old GuildListCode</comment>
        <payload dir="server" typename="worldGuildListStruct" sizechecktype="match"/>
    </opcode>
    <opcode id="6238" name="OP_SetChatServer" updated="06/29/05">
        <comment>Chatserver? IP,Port,servername.Charname,password(?)</comment>
    </opcode>
    <opcode id="6536" name="OP_SetChatServer2" updated="06/29/05">
        <comment>Chatserver? IP,Port,servername.Charname,password(?)</comment>
    </opcode>
    <opcode id="41b1" name="OP_ApproveWorld" updated="06/29/05">
        <comment></comment>
    </opcode>
    <opcode id="4668" name="OP_LogServer" updated="06/29/05">
        <comment></comment>
    </opcode>
    <opcode id="2792" name="OP_SendLoginInfo" updated="06/29/05">
        <comment>Client starting world session by asking for login information</comment>
    </opcode>
    <opcode id="509d" name="OP_WorldComplete" updated="06/29/05">
        <comment>Client telling world server it is done. World replies by disconnecting.</comment>
    </opcode>
    <opcode id="254d" name="OP_World_Client_CRC1" updated="06/29/05">
        <comment>Contains a snippet of spell data</comment>
    </opcode>
    <opcode id="16c9" name="OP_World_Client_CRC2" updated="06/29/05">
        <comment>Second client verification packet</comment>
    </opcode>
    <opcode id="5c78" name="OP_ExpansionInfo" updated="06/29/05">
        <comment>Which expansions user has</comment>
    </opcode>
    <opcode id="7262" name="OP_EnterWorld" updated="06/29/05">
        <comment>Server approval for client to enter world</comment>
    </opcode>
    <opcode id="0920" name="OP_DeleteCharacter" updated="06/29/05">
        <comment>Delete character @ char select</comment>
    </opcode>
    <opcode id="6160" name="OP_CharacterCreate" updated="06/29/04">
        <comment>Create character @ char select</comment>
    </opcode>
    <opcode id="46b1" name="OP_ApproveName" updated="06/29/04">
        <comment>Approving new character name @ char creation</comment>
    </opcode>
    <opcode id="23d4" name="OP_RandomNameGenerator" updated="06/29/05">
        <comment>Returns a random name</comment>
    </opcode>
</seqopcodes>
